Title,Abstract
Event-driven framework for detecting unusual patterns in AAL environments,"An aging population has motivated research into Ambient Assisted Living (AAL) with the aim of supporting people to continue to live in their homes as they age or with chronic health problems. As part of this work, some researchers have focused on identifying and reporting daily activities of individuals at home in order to try to reduce the workload on caregivers and health professionals. Such an environment is usually monitored by non-wearable sensors that collect a vast amount of data. The use of this data requires computational methods that can process it in a reasonable time. This paper proposes an event-driven framework to detect unusual patterns in AAL environments. A Fog-Cloud paradigm and Lambda architecture are adopted as the framework to support computational solutions to deal with the volume of data, and machine learning techniques are used for recognition of daily activities. The framework was evaluated through a case study based on data collected in a real environment. Results point to the feasibility of the proposal. © 2020 IEEE."
SLATE: Managing heterogeneous cloud functions,"This paper presents SLATE, a fully-managed, heterogeneous Function-as-a-Service (FaaS) system for deploying serverless functions onto heterogeneous cloud infrastructures. We extend the traditional homogeneous FaaS execution model to support heterogeneous functions, automating and abstracting runtime management of heterogeneous compute resources in order to improve cloud tenant accessibility to specialised, accelerator resources, such as FPGAs and GPUs. In particular, we focus on the mechanisms required for heterogeneous scaling of deployed function instances to guarantee latency objectives while minimising cost. We develop a simulator to validate and evaluate our approach, considering case-study functions in three application domains: machine learning, bio-informatics, and physics. We incorporate empirically derived performance models for each function implementation targeting a hardware platform with combined computational capacity of 24 FPGAs and 12 CPU cores. Compared to homogeneous CPU and homogeneous FPGA functions, simulation results achieve respectively a cost improvement for non-uniform task traffic of up to 8.7 times and 1.7 times, while maintaining specified latency objectives. © 2020 IEEE."
Refactoring of Neural Network Models for Hyperparameter Optimization in Serverless Cloud,"Machine Learning and Neural Networks in particular have become hot topics in Computer Science. The recent 2019 Turing award to the forefathers of Deep Learning and AI - Yoshua Bengio, Geoffrey Hinton, and Yann LeCun proves the importance of the technology and its effect on science and industry. However, we have realized that even nowadays, the state of the art methods require several manual steps for neural network hyperparameter optimization. Our approach automates the model tuning by refactoring the original Python code using open-source libraries for processing. We were able to identify hyperparameters by parsing the original source and analyzing it. Given these parameters, we refactor the model, add the state of the art optimization library calls, and run the updated code in the Serverless Cloud. Our approach has proven to eliminate manual steps for an arbitrary TensorFlow and Keras tuning. We have created a tool called OptPar which automatically refactors an arbitrary Deep Neural Network optimizing its hyperparameters. Such a transformation can save hours of time for Data Scientists, giving them an opportunity to concentrate on designing their Machine Learning algorithms. © 2020 ACM."
Le Taureau: Deconstructing the Serverless Landscape & A Look Forward,"Akin to the natural evolution of programming in assembly language to high-level languages, serverless computing represents the next frontier in the evolution of cloud computing: bare metal -> virtual machines -> containers -> serverless. The genesis of serverless computing can be traced back to the fundamental need of enabling a programmer to singularly focus on writing application code in a high-level language and isolating all facets of system management (for example, but not limited to, instance selection, scaling, deployment, logging, monitoring, fault tolerance and so on). This is particularly critical in light of today's, increasingly tightening, time-to-market constraints. Currently, serverless computing is supported by leading public cloud vendors, such as AWS Lambda, Google Cloud Functions, Azure Cloud Functions and others. While this is an important step in the right direction, there are many challenges going forward. For instance, but not limited to, how to enable support for dynamic optimization, how to extend support for stateful computation, how to efficiently bin-pack applications, how to support hardware heterogeneity (this will be key especially in light of the emergence of hardware accelerators for deep learning workloads). Inspired by Picasso's Le Taureau, in the tutorial proposed herein, we shall deconstruct evolution of serverless - - the overarching intent being to facilitate better understanding of the serverless landscape. This, we hope, would help push the innovation frontier on both fronts, the paradigm itself and the applications built atop of it. © 2020 Association for Computing Machinery."
Potential Bottleneck and Measuring Performance of Serverless Computing: A Literature Study,"Trending form of cloud computing is Serverless computing, where developer just needs to focus on his code rather than worrying about server management. In serverless computing, application is nothing but collection of one or more functions, written for specific business functionality, which triggers on an event. There are various cloud service providers, i.e. Amazon, Microsoft, Google, IBM, etc. who provide serverless services, on pay as you use and auto scalable solution to execute the application code as a function. The developer just needs to upload the code for execution. The performance of the serverless computing may vary due to dynamic configuration of the solution, technologies and different technology used by the service provider.This paper reviews various past and recent work in the serverless computing to identify possible bottlenecks and the scope of measuring performance of serverless computing. It will also put some light to leverage machine learning in various possible ways to do performance engineering for future research. © 2020 IEEE."
Prognostics by classifying degradation stage on lambda architecture,"To enhance the reliability and availability of an asset in its life, predicting the remaining useful life of an asset is strongly encouraged by assessing the extent of deviation or degradation of the asset's monitored parameters from its expected normal operating conditions. Although intelligent fault prognostic techniques such as machine learning and artificial neural networks have been applied in modern industries, application in actual industrial conditions requires that the forecasting process is revealed and more descriptive. To investigate the issue and increase the accuracy, this paper proposes an additional technique that can be further applied to any recent intelligent prognostic methods. The proposed method consists of two steps. First, the entire training set is divided into several degradation stages before regression using a heuristic approach and then the regression results are synthesized for each stage. The proposed method will increase the monotonicity of the predictive parameters, thus helping improve the predictive model's accuracy. To demonstrate the hypothesis, real condition monitoring data of high-pressure LNG pump and acceleration experimental data of a rotating machine is used for an experiment. Moreover, a system in which the proposed method can be appropriately executed is introduced with Lambda architecture. Finally, by demonstrating that the proposed method is capable of parallel computing, it is proven suitable for use in the proposed large-scale distributed processing system. © 2020 IEEE."
Proceedings of CISTI 2020 - 15th Iberian Conference on Information Systems and Technologies,The proceedings contain 366 papers. The topics discussed include: using machine learning for cognitive robotic process automation (RPA); acoustic monitoring system for teacher and student engagement evaluation; patient-centered healthcare monitoring in an outpatient scenario; serverless based control and monitoring for search and rescue robots; social engineering and the dangers of phishing; graphical semantic authentication; Moocs and other technological proposals in the transformation of education; performance evaluation of the virtualization environment of a microservices-based payroll system; enterprise architecture: critical factors and implementation; and processing UAV based RGB data to identify land cover with focus on small water body.
Federated Learning with Mutually Cooperating Devices: A Consensus Approach Towards Server-Less Model Optimization,"Federated learning (FL) is emerging as a new paradigm for training a machine learning model in cooperative networks. The model parameters are optimized collectively by large populations of interconnected devices, acting as cooperative learners that exchange local model updates with the server, rather than user data. The FL framework is however centralized, as it relies on the server for fusion of the model updates and as such it is limited by a single point of failure. In this paper we propose a distributed FL approach that performs a decentralized fusion of local model parameters by leveraging mutual cooperation between the devices and local (in-network) data operations via consensus-based methods. Communication with the server can be partially, or fully, replaced by in-network operations, scaling down the traffic load on the server as well as paving the way towards a fully serverless FL approach. This proposal also lays the groundwork for integration of FL methods within future (beyond 5G) wireless networks characterized by distributed and decentralized connectivity. The proposed algorithms are implemented and published as open source. They are also designed and verified by experimental data. © 2020 IEEE."
Cost-Effective Malware Detection as a Service over Serverless Cloud Using Deep Reinforcement Learning,"The current trends of cloud computing in general, and serverless computing in particular, affect multiple aspects of organizational activity. Organizations of all sizes are transitioning parts of their operations off-premise in order to reduce costs and scale their operations more efficiently. The field of network security is no exception, with many organizations taking advantage of the distributed and scalable cloud environment. Since the charging model for serverless computing is ""pay as you go"" (i.e., payment per action), a reduction in the number of required computations translates into significant cost savings. This understanding is also relevant to the field of malware detection, where organizations often deploy multiple types of detectors to increase detection accuracy. In this study, we utilize deep reinforcement learning to reduce computational costs in the cloud by selectively querying only a subset of available detectors. We demonstrate that our approach is not only effective both for on-premise and cloud-based computing architectures, but that applying it to serverless computing can reduce costs by an order of magnitude while maintaining near-optimal performance. © 2020 IEEE."
Federated Learning with Cooperating Devices: A Consensus Approach for Massive IoT Networks,"Federated learning (FL) is emerging as a new paradigm to train machine learning (ML) models in distributed systems. Rather than sharing and disclosing the training data set with the server, the model parameters (e.g., neural networks' weights and biases) are optimized collectively by large populations of interconnected devices, acting as local learners. FL can be applied to power-constrained Internet of Things (IoT) devices with slow and sporadic connections. In addition, it does not need data to be exported to third parties, preserving privacy. Despite these benefits, a main limit of existing approaches is the centralized optimization which relies on a server for aggregation and fusion of local parameters; this has the drawback of a single point of failure and scaling issues for increasing network size. This article proposes a fully distributed (or serverless) learning approach: the proposed FL algorithms leverage the cooperation of devices that perform data operations inside the network by iterating local computations and mutual interactions via consensus-based methods. The approach lays the groundwork for integration of FL within 5G and beyond networks characterized by decentralized connectivity and computing, with intelligence distributed over the end devices. The proposed methodology is verified by the experimental data sets collected inside an Industrial IoT (IIoT) environment. © 2014 IEEE."
Accelerated serverless computing based on GPU virtualization,"This paper introduces a platform to support serverless computing for scalable event-driven data processing that features a multi-level elasticity approach combined with virtualization of GPUs. The platform supports the execution of applications based on Docker containers in response to file uploads to a data storage in order to perform the data processing in parallel. This is managed by an elastic Kubernetes cluster whose size automatically grows and shrinks depending on the number of files to be processed. To accelerate the processing time of each file, several approaches involving virtualized access to GPUs, either locally or remote, have been evaluated. A use case that involves the inference based on deep learning techniques on transthoracic echocardiography imaging has been carried out to assess the benefits and limitations of the platform. The results indicate that the combination of serverless computing and GPU virtualization introduce an efficient and cost-effective event-driven accelerated computing approach that can be applied for a wide variety of scientific applications. © 2020 Elsevier Inc."
Polly: A Tool for Rapid Data Integration and Analysis in Support of Agricultural Research and Education,"Data analysis and modeling is a complex and demanding task. While a variety of software and tools exist to cope with this problem and tame big data operations, most of these tools are either not free, and when they are, they require large amount of configuration and steep learning curve. Moreover, they provide limited functionalities. In this paper we propose Polly, an online data analysis and modeling open-source tool that is intuitive to use and can be used with minimal or no configuration. Users can use Polly to rapidly integrate, analyze their data, prototype and test their novel methodologies. Polly can be used also as an educational tool. Users can use Polly to upload or connect to their structured data sources, load the required data into our system and perform various data processing tasks. Examples of such operations include data cleaning, data pre-processing, attribute encoding, regression and classification analysis. Aside from modeling, users can then download their results in the form of graphs in several standard visualization formats. While in this paper we focus on analyzing dataset for smart farming, our tool usage fits to a more general audience. To justify our backend design and implementation choices, we also present a performance analysis between backend virtualization technologies (containers or serverless computing), showing both expected and surprising results. © 2019 The Authors"
STOIC: Serverless Teleoperable Hybrid Cloud for Machine Learning Applications on Edge Device,"Serverless computing is a promising new event-driven programming model that was designed by cloud vendors to expedite the development and deployment of scalable web services on cloud computing systems. Using the model, developers write applications that consist of simple, independent, stateless functions that the cloud invokes on-demand (i.e. elastically), in response to system-wide events (data arrival, messages, web requests, etc.). In this work, we present STOIC (Serverless TeleOperable HybrId Cloud), an application scheduling and deployment system that extends the serverless model in two ways. First, it uses the model in a distributed setting and schedules application functions across multiple cloud systems. Second, STOIC supports serverless function execution using hardware acceleration (e.g. GPU resources) when available from the underlying cloud system. We overview the design and implementation of STOIC and empirically evaluate it using real-world machine learning applications and multi-tier (e.g. edge-cloud) deployments. We find that STOIC's combined use of edge and cloud resources is able to outperform using either cloud in isolation for the applications and datasets that we consider. © 2020 IEEE."
An Intelligent Doorbell Design Using Federated Deep Learning,"Smart doorbells have been playing an important role in protecting our modern homes. Existing approaches of sending video streams to a centralized server (or Cloud) for video analytics have been facing many challenges such as latency, bandwidth cost and more importantly users' privacy concerns. To address these challenges, this paper showcases the ability of an intelligent smart doorbell based on Federated Deep Learning, which can deploy and manage video analytics applications such as a smart doorbell across Edge and Cloud resources. This platform can scale, work with multiple devices, seamlessly manage online orchestration of the application components. The proposed framework is implemented using state-of-the-art technology. We implement the Federated Server using the Flask framework, containerized using Nginx and Gunicorn, which is deployed on AWS EC2 and AWS Serverless architecture. © 2021 Owner/Author."
Comparative study of real time machine learning models for stock prediction through streaming data,"Stock prediction is one of the emerging applications in the field of data science which help the companies to make better decision strategy. Machine learning models play a vital role in the field of prediction. In this paper, we have proposed various machine learning models which predicts the stock price from the real-time streaming data. Streaming data has been a potential source for real-time prediction which deals with continuous flow of data having information from various sources like social networking websites, server logs, mobile phone applications, trading floors etc. We have adopted the distributed platform, Spark to analyze the streaming data collected from two different sources as represented in two case studies in this paper. The first case study is based on stock prediction from the historical data collected from Google finance websites through NodeJs and the second one is based on the sentiment analysis of Twitter collected through Twitter API available in Stanford NLP package. Several researches have been made in developing models for stock prediction based on static data. In this work, an effort has been made to develop scalable, fault tolerant models for stock prediction from the real-time streaming data. The Proposed model is based on a distributed architecture known as Lambda architecture. The extensive comparison is made between actual and predicted output for different machine learning models.Support vector regression is found to have better accuracy as compared to other models. The historical data is considered as a ground truth data for validation. © 2020, IICM. All rights reserved."
Using cloud tools for literate programming to redesign an ai course for non-traditional college students,"As more open source educational software applications become available, higher educational institutions have the opportunity to utilize these cost efficient tools to deliver the instruction traditionally taught off line with heavy associated costs. Here we introduce a machine learning course that uses a simple, cloud computing approach to creating course materials. We see this type of serverless, cloud-based, literate programming to be the future of computer science education in non-traditional higher educational institutions in particular serving students who will need the basic literacy for computing and computation but will not pursue the traditional computer scientist path. © 2020, Association for the Advancement of Artificial Intelligence."
Contention-aware container placement strategy for docker swarm with machine learning based clustering algorithms,"Containerization technology utilizes operating system level virtualization to package applications to run with required libraries and are isolated from other processes on the same host. Lightweight and quick deployment make containers popular in many data centers. Running distributed applications in data centers usually involves multiple clusters of machines. Docker Swarm is a container orchestration tool for managing a cluster of Docker containers and their hosts. However, Docker Swarm’s scheduler does not consider resource utilization when placing containers in a cluster. This paper first investigated performance interference in container clusters. Our experimental study showed that distributed applications’ performance can be degraded when co-located with other containers which aggressively consume resources. A new scheduler is proposed to improve performance while keeping high resource utilization. The experimental results demonstrated that the proposed prototype with machine learning based clustering algorithms could effectively improve distributed applications’ performance by up to 14.5% with an average at around 12%. This work also provides theoretical bounds for the container placement problem. © 2020, Springer Science+Business Media, LLC, part of Springer Nature."
QoS-Aware Workload Distribution in Hierarchical Edge Clouds: A Reinforcement Learning Approach,"Recently, edge computing is getting attention as a new computing paradigm that is expected to achieve short-delay and high-throughput task offloading for large scale Internet-of-Things (IoT) applications. In edge computing, workload distribution is one of the most critical issues that largely influences the delay and throughput performance of edge clouds, especially in distributed Function-as-a-Service (FaaS) over networked edge nodes. In this paper, we propose the Resource Allocation Control Engine with Reinforcement learning (RACER), which provides an efficient workload distribution strategy to reduce the task response slowdown with per-task response time Quality-of-Service (QoS). First, we present a novel problem formulation with the per-task QoS constraint derived from the well-known token bucket mechanism. Second, we employ a problem relaxation to reduce the overall computation complexity by compromising just a bit of optimality. Lastly, we take the deep reinforcement learning approach as an alternative solution to the workload distribution problem to cope with the uncertainty and dynamicity of underlying environments. Evaluation results show that RACER achieves a significant improvement in terms of per-task QoS violation ratio, average slowdown, and control efficiency, compared to AREA, a state-of-the-art workload distribution method. © 2013 IEEE."
Real-time visualization of sensor data in smart manufacturing using lambda architecture,"Smart manufacturing technologies (Industry 4.0) as solutions to enhance productivity and improve efficiency are a priority to manufacturing industries worldwide. Such solutions have the ability to extract, integrate, analyze and visualize sensor and data from other legacy systems in order to enhance the operational performance. This paper proposes a solution to the challenge of real-time analysis and visualization of sensor and ERP data. Dynamic visualization is achieved using a machine learning approach. The combination of real-time visualization and machine learning allows for early detection and prevention of undesirable situations or outcomes. The prototype system has so far been tested by a smart manufacturing company with promising results. Copyright © 2020 by SCITEPRESS – Science and Technology Publications, Lda. All rights reserved."
"HotCloud 2020 - 12th USENIX Workshop on Hot Topics in Cloud Computing, co-located with USENIX ATC 2020",The proceedings contain 22 papers. The topics discussed include: a cloud gaming framework for dynamic graphical rendering towards achieving distributed game engines; towards supporting millions of users in modifiable virtual environments by redesigning minecraft-like games as serverless systems; AI4DL: mining behaviors of deep learning workloads for resource management; Spotnik: designing distributed machine learning for transient cloud resources; model-switching: dealing with fluctuating workloads in machine-learning-as-a-service systems; towards GPU utilization prediction for cloud deep learning; serverless boom or bust? an analysis of economic incentives; no reservations: a first look at Amazon’s reserved instance marketplace; and auto-sizing for stream processing applications at LinkedIn.
