Title,Abstract
Distributed Machine Learning with a Serverless Architecture,"The need to scale up machine learning, in the presence of a rapid growth of data both in volume and in variety, has sparked broad interests to develop distributed machine learning systems, typically based on parameter servers. However, since these systems are based on a dedicated cluster of physical or virtual machines, they have posed non-trivial cluster management overhead to machine learning practitioners and data scientists. In addition, there exists an inherent mismatch between the dynamically varying resource demands during a model training job and the inflexible resource provisioning model of current cluster-based systems.In this paper, we propose SIREN, an asynchronous distributed machine learning framework based on the emerging serverless architecture, with which stateless functions can be executed in the cloud without the complexity of building and maintaining virtual machine infrastructures. With SIREN, we are able to achieve a higher level of parallelism and elasticity by using a swarm of stateless functions, each working on a different batch of data, while greatly reducing system configuration overhead. Furthermore, we propose a scheduler based on Deep Reinforcement Learning to dynamically control the number and memory size of the stateless functions that should be used in each training epoch. The scheduler learns from the training process itself, in pursuit for the minimum possible training time given a cost. With our real-world prototype implementation on AWS Lambda, extensive experimental results have shown that SIREN can reduce model training time by up to 44%, as compared to traditional machine learning training benchmarks on AWS EC2 at the same cost. © 2019 IEEE."
Behavior analysis using serverless machine learning,"This paper supplies a route for using the Watson Machine Learning API on IBM Cloud to carry out serverless data analytics using machine learning as a service. Transforming the large amount of data produced by an organization into intelligence can be done using advanced analytics methods such as using a modified Mahalanobis Distance algorithm for synthesis of correlation data under the purview of machine learning. Further refinement of correlation data is done using a Multivariate Reliability Classifier model. The consumption of this advanced analytics service can be done in a serverless manner where the developer only must be concerned with how the data is analyzed, i.e., scoring, batch or stream models with a continuous learning system without the outlay of hardware upon which to train those models. This paper examines the usage of such serverless AI systems in the scope of user behavior analysis over varied demographics. © 2019 Bharati Vidyapeeth, New Delhi. Copy Right in Bulk will be transferred to IEEE by Bharati Vidyapeeth."
AI on the Move: From On-Device to On-Multi-Device,"On-Device AI is an emerging paradigm that aims to make devices more intelligent, autonomous and proactive by equipping them with machine and deep learning routines for robust decision making and optimal execution in devices' operations. On-Device intelligence promises the possibility of computing huge amounts of data close to its source, e.g., sensor and multimedia data. By doing so, devices can complement their counterpart cloud services with more sophisticated functionality to provide better applications and services. However, increased computational capabilities of smart devices, wearables and IoT devices along with the emergence of services at the Edge of the network are driving the trend of migrating and distributing computation between devices. Indeed, devices can reduce the burden of executing resource intensive tasks via collaborations in the wild. While several work has shown the benefits of an opportunistic collaboration of a device with others, not much is known regarding how devices can be organized as a group as they move together. In this paper, we contribute by analyzing how dynamic group organization of devices can be utilized to distribute intelligence on the moving Edge. The key insight is that instead of On-Device solutions complementing with cloud, dynamic groups can be formed to complement each other in an On-Multi-Device manner. Thus, we highlight the challenges and opportunities from extending the scope of On-Device AI from an egocentric view to a collaborative, multi-device view. © 2019 IEEE."
The next generation cognitive security operations center: Adaptive analytic lambda architecture for efficient defense against adversarial attacks,"A Security Operations Center (SOC) is a central technical level unit responsible for monitoring, analyzing, assessing, and defending an organization’s security posture on an ongoing basis. The SOC staff works closely with incident response teams, security analysts, network engineers and organization managers using sophisticated data processing technologies such as security analytics, threat intelligence, and asset criticality to ensure security issues are detected, analyzed and finally addressed quickly. Those techniques are part of a reactive security strategy because they rely on the human factor, experience and the judgment of security experts, using supplementary technology to evaluate the risk impact and minimize the attack surface. This study suggests an active security strategy that adopts a vigorous method including ingenuity, data analysis, processing and decision-making support to face various cyber hazards. Specifically, the paper introduces a novel intelligence driven cognitive computing SOC that is based exclusively on progressive fully automatic procedures. The proposed λ-Architecture Network Flow Forensics Framework (λ-NF3) is an efficient cybersecurity defense framework against adversarial attacks. It implements the Lambda machine learning architecture that can analyze a mixture of batch and streaming data, using two accurate novel computational intelligence algorithms. Specifically, it uses an Extreme Learning Machine neural network with Gaussian Radial Basis Function kernel (ELM/GRBFk) for the batch data analysis and a Self-Adjusting Memory k-Nearest Neighbors classifier (SAM/k-NN) to examine patterns from real-time streams. It is a forensics tool for big data that can enhance the automate defense strategies of SOCs to effectively respond to the threats their environments face. © 2019 by the authors. Licensee MDPI, Basel, Switzerland."
Big Data Ingestion and Lifelong Learning Architecture,"Lifelong Machine Learning (LML) mimics common human learning experiences. Humans undergo through long learning phase at start while studying followed by updating knowledge base incrementally from everyday instances. The objective is to retain past learnt knowledge and transfer learning to the next task iteratively. Training on the large data pool through a one-shot long running batch job limits the responsiveness and increases the infrastructure cost through large cluster requirements. The full dataset may not be available as well at the initiation of the training process. Through a review of previous work on lifelong machine leaning, we propose a Multi-agent Lambda Architecture (MALA) model to combine historical batch data with live streaming data to develop a lifelong learning system. MALA allows the streaming process to initialize itself with trained model from the batch data. Streaming process takes the batch data offset and incrementally updates the model iteratively with new waves of data. Reasons for our claim are presented through implementation of a recommender engine. © 2018 IEEE."
A Unified Framework for 5G Network Management Tools,"Limitations in the software architecture of current network management tools such as lack of support for combined batch and real time data processing, adaptive machine learning, support for heterogeneous data sources and the fragmentation of emerging solutions needs to be addressed in order to create a solid and forward leaning foundation for implementing 5G solutions. To address these limitations, this paper introduces the extended lambda architecture (ELA). It focuses on bringing agility and continuous learning based decision making support into the design of a unified architectural framework for new network management tools by combining batch and real time data processing with adaptive machine learning in a simple Monitor-Analyze-Plan-Execute over a shared Knowledge (MAPE-K) loop. The benefits of using this architecture are evaluated using a proof of concept (PoC) implementation of a reliable and proactive tool for detection and compensation of cell outages in a simulated 5G network. © 2018 IEEE."
Azure internet of things revealed: Architecture and fundamentals,"Introduction Design, build, and justify an optimal Microsoft IoT footprint to meet your project needs. This book describes common Internet of Things components and architecture and then focuses on Microsoft’s Azure components relevant in deploying these solutions. Microsoft-specific topics addressed include: deploying edge devices and pushing intelligence to the edge; connecting IoT devices to Azure and landing data there, applying Azure Machine Learning, analytics, and Cognitive Services; roles for Microsoft solution accelerators and managed solutions; and integration of the Azure footprint with legacy infrastructure. The book concludes with a discussion of best practices in defining and developing solutions and creating a plan for success. You will: Design the right IoT architecture to deliver solutions for a variety of project needs Connect IoT devices to Azure for data collection and delivery of services Use Azure Machine Learning and Cognitive Services to deliver intelligence in cloud-based solutions and at the edge Understand the benefits and tradeoffs of Microsoft’s solution accelerators and managed solutions Investigate new use cases that are described and apply best practices in deployment strategies Integrate cutting-edge Azure deployments with existing legacy data sources. © 2019 by Robert Stackowiak."
"Mark: Exploiting cloud services for cost-effective, slo-aware machine learning inference serving","The advances of Machine Learning (ML) have sparked a growing demand of ML-as-a-Service: developers train ML models and publish them in the cloud as online services to provide low-latency inference at scale. The key challenge of ML model serving is to meet the response-time Service-Level Objectives (SLOs) of inference workloads while minimizing the serving cost. In this paper, we tackle the dual challenge of SLO compliance and cost effectiveness with MArk (Model Ark), a general-purpose inference serving system built in Amazon Web Services (AWS). MArk employs three design choices tailor-made for inference workload. First, MArk dynamically batches requests and opportunistically serves them using expensive hardware accelerators (e.g., GPU) for improved performance-cost ratio. Second, instead of relying on feedback control scaling or over-provisioning to serve dynamic workload, which can be too slow or too expensive for inference serving, MArk employs predictive autoscaling to hide the provisioning latency at low cost. Third, given the stateless nature of inference serving, MArk exploits the flexible, yet costly serverless instances to cover the occasional load spikes that are hard to predict. We evaluated the performance of MArk using several state-of-the-art ML models trained in popular frameworks including TensorFlow, MXNet, and Keras. Compared with the premier industrial ML serving platform SageMaker, MArk reduces the serving cost up to 7.8× while achieving even better latency performance. © Proceedings of the 2019 USENIX Annual Technical Conference, USENIX ATC 2019. All rights reserved."
The Changing Role of the Software Engineer,"In this paper we will discuss the changing role of a software engineer. We will examine this from four major standpoints, the software development lifecycle, the influence of open source software, testing and deployment and the emergence of new technologies. We will first analyze what the role of a software engineer was in the past. We will examine limitations associated with software development life cycle models, and software failures that catalyzed increased importance for quality assurance. We then outline the current role of a software engineer. We discuss the impact of agile software development and automation on the software development cycle, the influence of open source software and how new technologies such as Function-as-a-Service and machine learning may impacted the role. Based on our research, we analyze why the software engineer role has changed and postulate prospective changes to the role of software engineer, and in particular how new responsibilities may affect the day to day work of future software engineers. We ultimately find that the role of a “software engineer” is nowadays widely varied and very broad, and it only generally indicates the type of work that the software engineer may undertake. © Springer Nature Switzerland AG 2019."
Stratum: A serverless framework for the lifecycle management of machine learning-based data analytics tasks,"With the proliferation of machine learning (ML) libraries and frameworks, and the programming languages that they use, along with operations of data loading, transformation, preparation and mining, ML model development is becoming a daunting task. Furthermore, with a plethora of cloud-based ML model development platforms, heterogeneity in hardware, increased focus on exploiting edge computing resources for low-latency prediction serving and often a lack of a complete understanding of resources required to execute ML workflows efficiently, ML model deployment demands expertise for managing the lifecycle of ML workflows efficiently and with minimal cost. To address these challenges, we propose an end-to-end data analytics, a serverless platform called Stratum. Stratum can deploy, schedule and dynamically manage data ingestion tools, live streaming apps, batch analytics tools, ML-as-a-service (for inference jobs), and visualization tools across the cloud-fog-edge spectrum. This paper describes the Stratum architecture highlighting the problems it resolves."
MPC with machine learning applied to resource allocation problem using lambda architecture,"The resource allocation problem is the process of allocating limited resources for a vast amount of tasks. Within this problem there are several important variants such as the stochastic time-variant resource allocation problem. This problem is relevant within environments where the distribution of resources varies with time, bringing difficulties to forecasting. Related research generally address the problem by using model predictive control (MPC) techniques or machine learning (ML) algorithms. However, both can be applied together in order to improve the tasks prioritization and forecasting. Therefore, this paper proposes a solution using the concept of lambda architecture in order to tackle the time-variant and the distinct input information. First results show that the integration between MPC and ML prioritizes the resource allocation and a Markov chain model is capable of forecasting tasks, optimizing a strategic binary control. We analyze a case study of a real problem and show how the proposal was built and its advantages over the traditional method. © 2019, IFAC (International Federation of Automatic Control) Hosting by Elsevier Ltd. All rights reserved."
Big-data architecture for electrical consumption forecasting in educational institutions buildings,"Recently, educational institutions suffer from high electrical consumption due to their new practices and activities. One of the promising solutions to overcome this challenge is to improve their energy management strategies using smart grids which ensure efficiency, reliability and energy saving. For this same reason, the National School of Applied Sciences of El Jadida - Morocco has decided to install a private smart grid based on photovoltaic panels that will cover 40% of its electricity needs. But the problem that arises when using this new approach is the high level of complexity in term of data management due to the variety, veracity and the volume of the data. So, to meet these needs the use of Big Data technologies is required. In this paper, we propose a Big Data solution based on Lambda architecture to handle electrical consumption data in the National School of Applied Sciences of El Jadida - Morocco. This system collects all parameters that might influence electrical consumption with Kafka, then it applies Spark libraries to analyze it. The solution allows also electrical energy forecasting using Spark machine learning library and the data persistence using HBase storage system. © 2019 Association for Computing Machinery."
"20th International Conference on Engineering Applications of Neural Networks, EANN 2019",The proceedings contain 46 papers. The special focus in this conference is on Engineering Applications of Neural Networks. The topics include: Enhanced feature selection for facial expression recognition systems with genetic algorithms; Imaging time-series for NILM; learning meaningful sentence embedding based on recursive auto-encoders; pruning extreme wavelets learning machine by automatic relevance determination; students’ performance prediction model using meta-classifier approach; a benchmark framework to evaluate energy disaggregation solutions; a deep network system for simulated autonomous driving using behavioral cloning; a machine hearing framework for real-time streaming analytics using lambda architecture; deep learning and change detection for fall recognition; image classification using deep neural networks: transfer learning and the handling of unknown images; LEARNAE: Distributed and resilient deep neural network training for heterogeneous peer to peer topologies; predicting customer churn using artificial neural network; virtual sensor based on a deep learning approach for estimating efficiency in chillers; canonical correlation analysis framework for the reduction of test time in industrial manufacturing quality tests; convolutional neural network for detection of building contours using multisource spatial data; a meta-multicriteria approach to estimate drought vulnerability based on fuzzy pattern recognition; application of deep learning long short-term memory in energy demand forecasting; bioinspired early prediction of earthquakes inferred by an evolving fuzzy neural network paradigm; enhancing disaster response for hazardous materials using emerging technologies: the role of ai and a research agenda; evolutionary optimization on artificial neural networks for predicting the user’s future semantic location; global minimum depth in edwards-anderson model; signal2Vec: Time series embedding representation.
A machine hearing framework for real-time streaming analytics using lambda architecture,"Disruptions to the earth’s biosphere and to the natural environment stemming from the indiscreet human activity, have caused serious environmental problems which are tantamount to an extended and prolonged ecological crisis. Climate change is clearly reflected in the increase of the global average air and ocean temperatures, in the excessive melting of snow-ice, and in the rise of the global average sea level. One of the most serious impacts of climate change is the complex interaction of species in relation to their corresponding climatic survival factors, which favors the spread of invasive species (INSP). These species constitute a very serious and rapidly deteriorating threat to the natural biodiversity of the native environment, but also to the flora, fauna, and even to the local human population. This research proposes a Machine Hearing (MH) framework for real-time streaming analytics, employing Lambda Architecture (LARC). The hybrid modeling effort is based on timely and advanced Computational Intelligence (COIN) approaches. The Framework for Lambda Architecture Machine Hearing (FLAME_H) uses a combination of batch and streaming data. The FLAME_H applies the EL_GROSEMMARI (Extreme Learning Graph Regularized Online Sequential Multilayer Multiencoder Algorithm) to classify the batch data and the Adaptive Random Forest (ARF) in order to control the data streams in real time. The aim of the proposed framework is the intelligent identification and classification of invasive alien species, based on the sounds they produce. This would contribute to the protection of biodiversity and biosecurity in a certain area. © Springer Nature Switzerland AG 2019."
Toward information system architecture to support predictive maintenance approach,"The prognostic and health management (PHM) approach aims at supporting maintenance operations in order to ensure the functionality of a system. In order to achieve this objective, a PHM approach is composed of a prognostic component, able to send a prognostic of failure, and a component able to give the health status of the system. Nowadays, this approach suffers from a lack of exploitation of the emerging technologies. This article presents a novel architecture for PHM approach able to extract added value from data. This lambda architecture embeds two layers: a speed layer and a storage layer. Thanks to the storage layer, maintenance rules can be applied as well as the result of machine learning algorithms to the speed layer in order to realize the prognostic aspect of the PHM. In addition, the system has to deal with heterogeneous data, which comes with the necessity to handle the big data issues as well as making it interoperable. This is achieved thanks to a service-oriented architecture approach and the use of complex event processing. © Springer Nature Switzerland AG 2019."
FaaStest - Machine learning based cost and performance FaaS optimization,"With the emergence of Function-as-a-Service (FaaS) in the cloud, pay-per-use pricing models became available along with the traditional fixed price model for VMs and increased the complexity of selecting the optimal platform for a given service. We present FaaStest - an autonomous solution for cost and performance optimization of FaaS services by taking a hybrid approach - learning the behavioral patterns of the service and dynamically selecting the optimal platform. Moreover, we combine a prediction based solution for reducing cold starts of FaaS services. Experiments present a reduction of over 50% in cost and over 90% in response time for FaaS calls. © 2019, Springer Nature Switzerland AG."
Towards predicting frailty symptoms through a smart walking stick,A warning sign of frailty is imbalance. Psycho-motor therapists run tests to evaluate the balance deterioration but not often enough to track the rapidly changing condition of the elderly. The proposed system collects fine-grained data from a smart cane and processes them with Machine Learning (ML) techniques. The originality of our proposition lies in its personalization by the elderly biomarkers in ML algorithms. Our experiments indicate that we can observe the orientation of locomotion through the cane as well as recognize characteristics of specific participants ambulation in the uncontrolled scenario. © 2018 IFIP.
Software Architecture Design of the Real- Time Processes Monitoring Platform,Understanding of how business processes are executed in real-life is vitally important for a company. Any process leaves a digital footprint that can be transformed into so-called event logs and analyzed with process mining techniques. A software platform with the purpose of near realtime processes monitoring is implemented. Design of the represented platform is based on the lambda architecture combining online and offline process mining algorithms with advanced analytics based on machine learning. © 2018 IEEE.
